{
  "schema_version": "1.0.0",
  "manifest_id": "harness-source:web-research-full",
  "harness_version": "1.2.3",
  "profile": "web-research-full",
  "global_excludes": [
    ".git", ".private", ".lake", "__pycache__", "*.pyc", "*.pyo",
    "sessions", "raw", "derived", "staging", "vendor/upstream", "build"
  ],
  "excluded_container_skill_ids": ["auto-goal", "auto-tmux", "nvidia-private-compute"],
  "generated_files": [
    "WEB_CHANNEL_PROFILE.json",
    "WEB_ACTIVE_SKILLS.json",
    "WEB_OUTPUT_CONTRACT.json",
    "WEB_BOOTSTRAP.md",
    "HARNESS_SNAPSHOT.json",
    "HARNESS_SNAPSHOT_HISTORY.json",
    "problem-library/records/canonical-problems.jsonl",
    "research/records/attempts.jsonl",
    "research/records/failed-routes.jsonl",
    "research/records/obligation-graphs.jsonl",
    "research/records/candidate-artifacts.jsonl",
    "research/records/evidence-links.jsonl",
    "result-library/records/results.jsonl"
  ],
  "entries": [
    {
      "source_path": "governance/tasks/0027-web-gpt-github-chat-research-harness/WEB_PROJECT_AGENTS.md",
      "target_path": "governance/harness/PROJECT_AGENTS.md",
      "kind": "file",
      "layer": "research_core",
      "required": true,
      "owner": "harness",
      "privacy_class": "internal_code",
      "rewrite_policy": "replace_from_source",
      "license_ref": null,
      "excludes": []
    },
    {
      "source_path": "governance/tasks/0027-web-gpt-github-chat-research-harness/WEB_CODEX_AGENTS.md",
      "target_path": ".codex/AGENTS.md",
      "kind": "file",
      "layer": "math_layer",
      "required": true,
      "owner": "harness",
      "privacy_class": "internal_code",
      "rewrite_policy": "replace_from_source",
      "license_ref": null,
      "excludes": []
    },
    {
      "source_path": ".codex/skills",
      "target_path": ".codex/skills",
      "kind": "tree",
      "layer": "math_layer",
      "required": true,
      "owner": "harness",
      "privacy_class": "internal_code",
      "rewrite_policy": "replace_from_source",
      "license_ref": null,
      "excludes": ["nvidia-private-compute", "__pycache__", "*.pyc"]
    },
    {
      "source_path": "governance/tasks/0027-web-gpt-github-chat-research-harness/container-skill-snapshots/solve",
      "target_path": ".codex/skills/solve",
      "kind": "tree",
      "layer": "math_layer",
      "required": true,
      "owner": "harness",
      "privacy_class": "internal_code",
      "rewrite_policy": "replace_from_source",
      "license_ref": null,
      "excludes": ["__pycache__", "*.pyc"]
    },
    {
      "source_path": "governance/tasks/0027-web-gpt-github-chat-research-harness/container-skill-snapshots/math-toolchain",
      "target_path": ".codex/skills/math-toolchain",
      "kind": "tree",
      "layer": "math_layer",
      "required": true,
      "owner": "harness",
      "privacy_class": "internal_code",
      "rewrite_policy": "replace_from_source",
      "license_ref": null,
      "excludes": ["__pycache__", "*.pyc"]
    },
    {
      "source_path": "requirements.txt",
      "target_path": "requirements.txt",
      "kind": "file",
      "layer": "research_core",
      "required": true,
      "owner": "harness",
      "privacy_class": "public_code",
      "rewrite_policy": "replace_from_source",
      "license_ref": null,
      "excludes": []
    },
    {
      "source_path": "requirements-math-tools.txt",
      "target_path": "requirements-math-tools.txt",
      "kind": "file",
      "layer": "math_layer",
      "required": true,
      "owner": "harness",
      "privacy_class": "public_code",
      "rewrite_policy": "replace_from_source",
      "license_ref": null,
      "excludes": []
    },
    {
      "source_path": "governance/context/AGENT-ENTRY.md",
      "target_path": "governance/context/AGENT-ENTRY.md",
      "kind": "file",
      "layer": "research_core",
      "required": true,
      "owner": "harness",
      "privacy_class": "internal_code",
      "rewrite_policy": "replace_from_source",
      "license_ref": null,
      "excludes": []
    },
    {
      "source_path": "governance/tasks/0027-web-gpt-github-chat-research-harness/WEB_OPERATING_MODEL.md",
      "target_path": "governance/context/PROJECT_OPERATING_MODEL.md",
      "kind": "file",
      "layer": "research_core",
      "required": true,
      "owner": "harness",
      "privacy_class": "internal_code",
      "rewrite_policy": "replace_from_source",
      "license_ref": null,
      "excludes": []
    },
    {
      "source_path": "governance/tasks/0027-web-gpt-github-chat-research-harness/WEB_TOOLCHAIN_MODEL.md",
      "target_path": "governance/context/TOOLCHAIN_MODEL.md",
      "kind": "file",
      "layer": "research_core",
      "required": true,
      "owner": "harness",
      "privacy_class": "internal_code",
      "rewrite_policy": "replace_from_source",
      "license_ref": null,
      "excludes": []
    },
    {
      "source_path": "governance/standards",
      "target_path": "governance/standards",
      "kind": "tree",
      "layer": "research_core",
      "required": true,
      "owner": "harness",
      "privacy_class": "internal_code",
      "rewrite_policy": "replace_from_source",
      "license_ref": null,
      "excludes": []
    },
    {
      "source_path": "governance/tasks/0027-web-gpt-github-chat-research-harness/WEB_PROBLEM_REPOSITORY_TOPOLOGY.md",
      "target_path": "governance/processes/WEB_PROBLEM_REPOSITORY_TOPOLOGY.md",
      "kind": "file",
      "layer": "research_core",
      "required": true,
      "owner": "harness",
      "privacy_class": "internal_code",
      "rewrite_policy": "replace_from_source",
      "license_ref": null,
      "excludes": []
    },
    {
      "source_path": "governance/control-plane/math-tool-maturity.schema.json",
      "target_path": "governance/control-plane/math-tool-maturity.schema.json",
      "kind": "file",
      "layer": "math_layer",
      "required": true,
      "owner": "harness",
      "privacy_class": "internal_code",
      "rewrite_policy": "replace_from_source",
      "license_ref": null,
      "excludes": []
    },
    {
      "source_path": "governance/control-plane/math-tool-maturity.v1.json",
      "target_path": "governance/control-plane/math-tool-maturity.v1.json",
      "kind": "file",
      "layer": "math_layer",
      "required": true,
      "owner": "harness",
      "privacy_class": "internal_code",
      "rewrite_policy": "replace_from_source",
      "license_ref": null,
      "excludes": []
    },
    {
      "source_path": "governance/control-plane/mathematical-reasoning-discipline.schema.json",
      "target_path": "governance/control-plane/mathematical-reasoning-discipline.schema.json",
      "kind": "file",
      "layer": "research_core",
      "required": true,
      "owner": "harness",
      "privacy_class": "internal_code",
      "rewrite_policy": "replace_from_source",
      "license_ref": null,
      "excludes": []
    },
    {
      "source_path": "governance/control-plane/mathematical-reasoning-discipline.v1.json",
      "target_path": "governance/control-plane/mathematical-reasoning-discipline.v1.json",
      "kind": "file",
      "layer": "research_core",
      "required": true,
      "owner": "harness",
      "privacy_class": "internal_code",
      "rewrite_policy": "replace_from_source",
      "license_ref": null,
      "excludes": []
    },
    {
      "source_path": "governance/control-plane/math-knowledge-source.schema.json",
      "target_path": "governance/control-plane/math-knowledge-source.schema.json",
      "kind": "file",
      "layer": "math_layer",
      "required": true,
      "owner": "harness",
      "privacy_class": "internal_code",
      "rewrite_policy": "replace_from_source",
      "license_ref": null,
      "excludes": []
    },
    {
      "source_path": "governance/control-plane/math-knowledge-source.v1.json",
      "target_path": "governance/control-plane/math-knowledge-source.v1.json",
      "kind": "file",
      "layer": "math_layer",
      "required": true,
      "owner": "harness",
      "privacy_class": "internal_code",
      "rewrite_policy": "replace_from_source",
      "license_ref": null,
      "excludes": []
    },
    {
      "source_path": "governance/control-plane/math-knowledge-operators.schema.json",
      "target_path": "governance/control-plane/math-knowledge-operators.schema.json",
      "kind": "file",
      "layer": "math_layer",
      "required": true,
      "owner": "harness",
      "privacy_class": "internal_code",
      "rewrite_policy": "replace_from_source",
      "license_ref": null,
      "excludes": []
    },
    {
      "source_path": "governance/control-plane/math-knowledge-operators.v1.json",
      "target_path": "governance/control-plane/math-knowledge-operators.v1.json",
      "kind": "file",
      "layer": "math_layer",
      "required": true,
      "owner": "harness",
      "privacy_class": "internal_code",
      "rewrite_policy": "replace_from_source",
      "license_ref": null,
      "excludes": []
    },
    {
      "source_path": "governance/control-plane/web-research-channel.schema.json",
      "target_path": "governance/control-plane/web-research-channel.schema.json",
      "kind": "file",
      "layer": "web_channel",
      "required": true,
      "owner": "harness",
      "privacy_class": "internal_code",
      "rewrite_policy": "replace_from_source",
      "license_ref": null,
      "excludes": []
    },
    {
      "source_path": "governance/control-plane/web-research-channel.v1.json",
      "target_path": "governance/control-plane/web-research-channel.v1.json",
      "kind": "file",
      "layer": "web_channel",
      "required": true,
      "owner": "harness",
      "privacy_class": "internal_code",
      "rewrite_policy": "replace_from_source",
      "license_ref": null,
      "excludes": []
    },
    {
      "source_path": "governance/tasks/0027-web-gpt-github-chat-research-harness/WEB_CHANNEL_REQUIREMENTS_SNAPSHOT.md",